question,answer,formatted_text,source
Apa itu esai naratif?,"Esai naratif adalah esai yang menceritakan sebuah peristiwa atau pengalaman pribadi secara kronologis, lengkap dengan tokoh, konflik, latar, dan alur seperti sebuah cerita. Tujuannya menyampaikan pesan atau pelajaran melalui pengalaman yang diceritakan, bukan sekadar memaparkan informasi. Sumber: Purdue OWL, Essay Writing; Scribbr, The Four Main Types of Essay.","Pertanyaan: Apa itu esai naratif?
Jawaban: Esai naratif adalah esai yang menceritakan sebuah peristiwa atau pengalaman pribadi secara kronologis, lengkap dengan tokoh, konflik, latar, dan alur seperti sebuah cerita. Tujuannya menyampaikan pesan atau pelajaran melalui pengalaman yang diceritakan, bukan sekadar memaparkan informasi. Sumber: Purdue OWL, Essay Writing; Scribbr, The Four Main Types of Essay.",Buku Siswa Bahasa Indonesia Kurikulum Merdeka - Kemdikbud (buku.kemdikbud.go.id)
Berapa panjang ideal sebuah esai akademik?,"Panjang esai akademik bergantung pada tujuan dan ketentuan tugas, tetapi struktur minimal yang umum digunakan adalah pola esai lima paragraf: satu paragraf pendahuluan, tiga paragraf isi, dan satu paragraf penutup. Untuk esai yang lebih kompleks, jumlah paragraf isi dapat ditambah selama setiap paragraf tetap fokus mendukung satu gagasan yang berkaitan dengan tesis. Sumber: Purdue OWL, Essay Writing.","Pertanyaan: Berapa panjang ideal sebuah esai akademik?
Jawaban: Panjang esai akademik bergantung pada tujuan dan ketentuan tugas, tetapi struktur minimal yang umum digunakan adalah pola esai lima paragraf: satu paragraf pendahuluan, tiga paragraf isi, dan satu paragraf penutup. Untuk esai yang lebih kompleks, jumlah paragraf isi dapat ditambah selama setiap paragraf tetap fokus mendukung satu gagasan yang berkaitan dengan tesis. Sumber: Purdue OWL, Essay Writing.",Buku Siswa Bahasa Indonesia Kurikulum Merdeka - Kemdikbud (buku.kemdikbud.go.id)
Apa bedanya esai dengan artikel opini?,"Esai umumnya lebih personal dan reflektif, memberi ruang bagi penulis untuk mengeksplorasi gagasan secara lebih bebas meski tetap terstruktur. Artikel opini biasanya ditulis untuk media massa, lebih ringkas, langsung merespons isu aktual, dan bertujuan memengaruhi pandangan publik dalam waktu singkat. Keduanya sama-sama menyampaikan sudut pandang penulis, tetapi esai memberi ruang pengembangan argumen yang lebih mendalam. Sumber: Buku Siswa Bahasa Indonesia Kurikulum Merdeka, Kemdikbud.","Pertanyaan: Apa bedanya esai dengan artikel opini?
Jawaban: Esai umumnya lebih personal dan reflektif, memberi ruang bagi penulis untuk mengeksplorasi gagasan secara lebih bebas meski tetap terstruktur. Artikel opini biasanya ditulis untuk media massa, lebih ringkas, langsung merespons isu aktual, dan bertujuan memengaruhi pandangan publik dalam waktu singkat. Keduanya sama-sama menyampaikan sudut pandang penulis, tetapi esai memberi ruang pengembangan argumen yang lebih mendalam. Sumber: Buku Siswa Bahasa Indonesia Kurikulum Merdeka, Kemdikbud.",Buku Siswa Bahasa Indonesia Kurikulum Merdeka - Kemdikbud (buku.kemdikbud.go.id)
Apa itu paragraf deduktif dan induktif?,"Paragraf deduktif adalah paragraf yang kalimat utamanya terletak di awal, kemudian diikuti kalimat-kalimat penjelas. Paragraf induktif adalah paragraf yang kalimat penjelasnya disampaikan terlebih dahulu, kemudian ditutup dengan kalimat utama berupa simpulan di akhir paragraf. Ada pula paragraf campuran yang kalimat utamanya muncul di awal dan ditegaskan kembali di akhir paragraf. Sumber: Buku Siswa Bahasa Indonesia Kurikulum Merdeka, Kemdikbud.","Pertanyaan: Apa itu paragraf deduktif dan induktif?
Jawaban: Paragraf deduktif adalah paragraf yang kalimat utamanya terletak di awal, kemudian diikuti kalimat-kalimat penjelas. Paragraf induktif adalah paragraf yang kalimat penjelasnya disampaikan terlebih dahulu, kemudian ditutup dengan kalimat utama berupa simpulan di akhir paragraf. Ada pula paragraf campuran yang kalimat utamanya muncul di awal dan ditegaskan kembali di akhir paragraf. Sumber: Buku Siswa Bahasa Indonesia Kurikulum Merdeka, Kemdikbud.",Buku Siswa Bahasa Indonesia Kurikulum Merdeka - Kemdikbud (buku.kemdikbud.go.id)
Bagaimana cara menjaga koherensi antarparagraf dalam esai?,"Koherensi antarparagraf dijaga dengan memastikan setiap paragraf isi berkaitan langsung dengan tesis, menggunakan kalimat transisi di awal paragraf untuk menghubungkan gagasan dengan paragraf sebelumnya, dan menyusun urutan paragraf secara logis, misalnya dari argumen terlemah ke argumen terkuat atau berdasarkan kronologi. Sumber: Purdue OWL, Essay Writing; Stephen Bailey, Academic Writing for University Students (Routledge).","Pertanyaan: Bagaimana cara menjaga koherensi antarparagraf dalam esai?
Jawaban: Koherensi antarparagraf dijaga dengan memastikan setiap paragraf isi berkaitan langsung dengan tesis, menggunakan kalimat transisi di awal paragraf untuk menghubungkan gagasan dengan paragraf sebelumnya, dan menyusun urutan paragraf secara logis, misalnya dari argumen terlemah ke argumen terkuat atau berdasarkan kronologi. Sumber: Purdue OWL, Essay Writing; Stephen Bailey, Academic Writing for University Students (Routledge).",Buku Siswa Bahasa Indonesia Kurikulum Merdeka - Kemdikbud (buku.kemdikbud.go.id)
Apa itu kesatuan (unity) dalam paragraf?,"Kesatuan (unity) dalam paragraf berarti seluruh kalimat dalam paragraf tersebut hanya membahas satu gagasan utama. Kalimat yang tidak berkaitan langsung dengan gagasan utama sebaiknya dihilangkan atau dipindahkan ke paragraf lain agar paragraf tetap fokus dan mudah dipahami pembaca. Sumber: Purdue OWL, Essay Writing.","Pertanyaan: Apa itu kesatuan (unity) dalam paragraf?
Jawaban: Kesatuan (unity) dalam paragraf berarti seluruh kalimat dalam paragraf tersebut hanya membahas satu gagasan utama. Kalimat yang tidak berkaitan langsung dengan gagasan utama sebaiknya dihilangkan atau dipindahkan ke paragraf lain agar paragraf tetap fokus dan mudah dipahami pembaca. Sumber: Purdue OWL, Essay Writing.",Buku Siswa Bahasa Indonesia Kurikulum Merdeka - Kemdikbud (buku.kemdikbud.go.id)
Siapa audiens dan apa tujuan yang perlu ditentukan sebelum menulis esai?,"Sebelum menulis esai, penulis perlu menentukan audiens atau siapa yang akan membaca, serta tujuan penulisan seperti menginformasikan, meyakinkan, menceritakan, atau menggambarkan, karena keduanya menentukan pilihan gaya bahasa, tingkat formalitas, dan jenis esai yang digunakan. Sumber: Purdue OWL, The Writing Process; Stephen Bailey, Academic Writing for University Students (Routledge).","Pertanyaan: Siapa audiens dan apa tujuan yang perlu ditentukan sebelum menulis esai?
Jawaban: Sebelum menulis esai, penulis perlu menentukan audiens atau siapa yang akan membaca, serta tujuan penulisan seperti menginformasikan, meyakinkan, menceritakan, atau menggambarkan, karena keduanya menentukan pilihan gaya bahasa, tingkat formalitas, dan jenis esai yang digunakan. Sumber: Purdue OWL, The Writing Process; Stephen Bailey, Academic Writing for University Students (Routledge).",Buku Siswa Bahasa Indonesia Kurikulum Merdeka - Kemdikbud (buku.kemdikbud.go.id)
Kapan huruf miring digunakan untuk kata asing atau daerah?,"Kenapa nama ilmiah dan kata bahasa daerah ditulis miring? Huruf miring dipakai untuk menuliskan kata atau ungkapan dalam bahasa daerah atau bahasa asing yang belum sepenuhnya terserap ke dalam bahasa Indonesia, misalnya nama ilmiah atau ungkapan asing.","Pertanyaan: Kapan huruf miring digunakan untuk kata asing atau daerah?
Jawaban: Kenapa nama ilmiah dan kata bahasa daerah ditulis miring? Huruf miring dipakai untuk menuliskan kata atau ungkapan dalam bahasa daerah atau bahasa asing yang belum sepenuhnya terserap ke dalam bahasa Indonesia, misalnya nama ilmiah atau ungkapan asing.
Contoh Kesalahan: Ia gemar membaca buku tentang Panthera tigris sumatrae.
Contoh Perbaikan: Ia gemar membaca buku tentang *Panthera tigris sumatrae*.",EYD V - Badan Bahasa Kemendikbudristek (ejaan.kemendikdasmen.go.id)
Apakah judul buku dan nama media harus ditulis miring?,"Kenapa judul novel dan nama koran ditulis miring dalam kalimat? Huruf miring dipakai untuk menuliskan judul buku, nama majalah, atau nama surat kabar yang dikutip dalam tulisan, kecuali dalam daftar pustaka yang mengikuti aturan sitasi tersendiri.","Pertanyaan: Apakah judul buku dan nama media harus ditulis miring?
Jawaban: Kenapa judul novel dan nama koran ditulis miring dalam kalimat? Huruf miring dipakai untuk menuliskan judul buku, nama majalah, atau nama surat kabar yang dikutip dalam tulisan, kecuali dalam daftar pustaka yang mengikuti aturan sitasi tersendiri.
Contoh Kesalahan: Saya membaca novel Laskar Pelangi dan koran Kompas pagi ini.
Contoh Perbaikan: Saya membaca novel *Laskar Pelangi* dan koran *Kompas* pagi ini.",EYD V - Badan Bahasa Kemendikbudristek (ejaan.kemendikdasmen.go.id)
Kapan huruf miring dipakai untuk menegaskan bagian kata?,"Bagaimana cara menekankan satu kata dalam kalimat tertulis? Huruf miring dipakai untuk menegaskan atau mengkhususkan huruf, bagian kata, atau kelompok kata dalam kalimat, misalnya untuk membedakan makna sebuah kata dari kata lain di sekitarnya.","Pertanyaan: Kapan huruf miring dipakai untuk menegaskan bagian kata?
Jawaban: Bagaimana cara menekankan satu kata dalam kalimat tertulis? Huruf miring dipakai untuk menegaskan atau mengkhususkan huruf, bagian kata, atau kelompok kata dalam kalimat, misalnya untuk membedakan makna sebuah kata dari kata lain di sekitarnya.
Contoh Kesalahan: Dia bukan akan pergi, tetapi sudah pergi.
Contoh Perbaikan: Dia *bukan* akan pergi, tetapi *sudah* pergi.",EYD V - Badan Bahasa Kemendikbudristek (ejaan.kemendikdasmen.go.id)
Kapan bilangan ditulis dengan angka dan kapan dengan huruf?,"Kenapa 5 anak harus ditulis lima anak dalam kalimat? Bilangan yang dapat dinyatakan dengan satu atau dua kata ditulis dengan huruf, sedangkan bilangan yang memerlukan lebih dari dua kata ditulis dengan angka. Angka juga dipakai untuk menyatakan ukuran, jumlah uang, dan nomor jalan.","Pertanyaan: Kapan bilangan ditulis dengan angka dan kapan dengan huruf?
Jawaban: Kenapa 5 anak harus ditulis lima anak dalam kalimat? Bilangan yang dapat dinyatakan dengan satu atau dua kata ditulis dengan huruf, sedangkan bilangan yang memerlukan lebih dari dua kata ditulis dengan angka. Angka juga dipakai untuk menyatakan ukuran, jumlah uang, dan nomor jalan.
Contoh Kesalahan: Ia mempunyai 5 orang anak. Jalan itu sepanjang 2 kilometer.
Contoh Perbaikan: Ia mempunyai lima orang anak. Jalan itu sepanjang 2 km.",EYD V - Badan Bahasa Kemendikbudristek (ejaan.kemendikdasmen.go.id)
Bagaimana cara menulis bilangan tingkat?,"Apakah abad ke 20 atau abad ke-20 yang benar? Bilangan tingkat ditulis dengan mencantumkan tanda hubung setelah ke, atau dapat pula ditulis dengan huruf, misalnya ke-2 atau kedua. Penulisan ke2 tanpa tanda hubung dan ke II dengan angka Romawi tidak dibenarkan dalam kalimat biasa.","Pertanyaan: Bagaimana cara menulis bilangan tingkat?
Jawaban: Apakah abad ke 20 atau abad ke-20 yang benar? Bilangan tingkat ditulis dengan mencantumkan tanda hubung setelah ke, atau dapat pula ditulis dengan huruf, misalnya ke-2 atau kedua. Penulisan ke2 tanpa tanda hubung dan ke II dengan angka Romawi tidak dibenarkan dalam kalimat biasa.
Contoh Kesalahan: Ia juara ke 2 dalam lomba itu. Peristiwa itu terjadi pada abad ke XX.
Contoh Perbaikan: Ia juara ke-2 dalam lomba itu. Peristiwa itu terjadi pada abad ke-20.",EYD V - Badan Bahasa Kemendikbudristek (ejaan.kemendikdasmen.go.id)
Apa saja jenis singkatan dan aturan penulisan tandanya?,"Apakah dll dan dsb pakai titik? Singkatan umum yang terdiri atas tiga huruf atau lebih diikuti satu tanda titik, misalnya dll., dsb., yth., hlm. Singkatan nama orang, nama lembaga, atau ukuran resmi yang terdiri atas huruf awal kata umumnya tidak diikuti titik, misalnya PT, SMA, kg, cm.","Pertanyaan: Apa saja jenis singkatan dan aturan penulisan tandanya?
Jawaban: Apakah dll dan dsb pakai titik? Singkatan umum yang terdiri atas tiga huruf atau lebih diikuti satu tanda titik, misalnya dll., dsb., yth., hlm. Singkatan nama orang, nama lembaga, atau ukuran resmi yang terdiri atas huruf awal kata umumnya tidak diikuti titik, misalnya PT, SMA, kg, cm.
Contoh Kesalahan: Ia membawa buku, pensil, dsb tanpa titik. Berat barang itu 5 kg. dengan titik.
Contoh Perbaikan: Ia membawa buku, pensil, dsb. Berat barang itu 5 kg.",EYD V - Badan Bahasa Kemendikbudristek (ejaan.kemendikdasmen.go.id)
Apa bedanya akronim nama diri dan akronim bukan nama diri?,"Kenapa Kowani huruf besar tapi pemilu huruf kecil? Akronim nama diri yang berupa gabungan huruf awal setiap kata ditulis dengan huruf kapital seluruhnya, misalnya ABRI atau LAN. Akronim nama diri berupa gabungan suku kata atau huruf dan suku kata ditulis dengan huruf awal kapital, misalnya Bulog atau Kowani. Akronim yang bukan nama diri ditulis seluruhnya dengan huruf kecil, misalnya pemilu, rudal, dan tilang.","Pertanyaan: Apa bedanya akronim nama diri dan akronim bukan nama diri?
Jawaban: Kenapa Kowani huruf besar tapi pemilu huruf kecil? Akronim nama diri yang berupa gabungan huruf awal setiap kata ditulis dengan huruf kapital seluruhnya, misalnya ABRI atau LAN. Akronim nama diri berupa gabungan suku kata atau huruf dan suku kata ditulis dengan huruf awal kapital, misalnya Bulog atau Kowani. Akronim yang bukan nama diri ditulis seluruhnya dengan huruf kecil, misalnya pemilu, rudal, dan tilang.
Contoh Kesalahan: Ia bekerja di lembaga bulog. Acara Pemilu digelar setiap 5 tahun.
Contoh Perbaikan: Ia bekerja di lembaga Bulog. Acara pemilu digelar setiap 5 tahun.",EYD V - Badan Bahasa Kemendikbudristek (ejaan.kemendikdasmen.go.id)
Kapan tanda titik dua digunakan dalam kalimat?,"Kapan pakai titik dua sebelum rincian? Tanda titik dua dipakai pada akhir suatu pernyataan lengkap yang diikuti rangkaian atau pemerincian, serta di antara jilid atau nomor halaman, bab dan ayat kitab suci, judul dan anak judul, serta nama kota dan penerbit dalam daftar pustaka. Tanda titik dua tidak dipakai jika rincian merupakan pelengkap yang mengakhiri pernyataan.","Pertanyaan: Kapan tanda titik dua digunakan dalam kalimat?
Jawaban: Kapan pakai titik dua sebelum rincian? Tanda titik dua dipakai pada akhir suatu pernyataan lengkap yang diikuti rangkaian atau pemerincian, serta di antara jilid atau nomor halaman, bab dan ayat kitab suci, judul dan anak judul, serta nama kota dan penerbit dalam daftar pustaka. Tanda titik dua tidak dipakai jika rincian merupakan pelengkap yang mengakhiri pernyataan.
Contoh Kesalahan: Kita memerlukan kursi, meja, dan lemari. Ia hanya membawa: tas dan buku.
Contoh Perbaikan: Kita memerlukan: kursi, meja, dan lemari. Ia hanya membawa tas dan buku.",EYD V - Badan Bahasa Kemendikbudristek (ejaan.kemendikdasmen.go.id)
Kapan tanda titik koma digunakan?,"Bagaimana cara menggabungkan dua kalimat setara tanpa kata hubung? Tanda titik koma dipakai untuk memisahkan kalimat setara di dalam kalimat majemuk sebagai pengganti kata penghubung, dan untuk memisahkan bagian-bagian perincian yang sudah mengandung tanda koma agar lebih jelas batasnya.","Pertanyaan: Kapan tanda titik koma digunakan?
Jawaban: Bagaimana cara menggabungkan dua kalimat setara tanpa kata hubung? Tanda titik koma dipakai untuk memisahkan kalimat setara di dalam kalimat majemuk sebagai pengganti kata penghubung, dan untuk memisahkan bagian-bagian perincian yang sudah mengandung tanda koma agar lebih jelas batasnya.
Contoh Kesalahan: Malam makin larut, pekerjaan belum selesai juga.
Contoh Perbaikan: Malam makin larut; pekerjaan belum selesai juga.",EYD V - Badan Bahasa Kemendikbudristek (ejaan.kemendikdasmen.go.id)
Bagaimana penulisan tanda tanya yang benar dalam kalimat?,Apakah tanda tanya bisa dipakai di tengah kalimat? Tanda tanya dipakai pada akhir kalimat tanya. Tanda tanya yang diletakkan di dalam tanda kurung menyatakan bagian kalimat yang disangsikan atau kurang dapat dibuktikan kebenarannya.,"Pertanyaan: Bagaimana penulisan tanda tanya yang benar dalam kalimat?
Jawaban: Apakah tanda tanya bisa dipakai di tengah kalimat? Tanda tanya dipakai pada akhir kalimat tanya. Tanda tanya yang diletakkan di dalam tanda kurung menyatakan bagian kalimat yang disangsikan atau kurang dapat dibuktikan kebenarannya.
Contoh Kesalahan: Kapan ia berangkat.
Contoh Perbaikan: Kapan ia berangkat? Ia lahir pada tahun 1961 (?) di Bandung.",EYD V - Badan Bahasa Kemendikbudristek (ejaan.kemendikdasmen.go.id)
Kapan tanda seru digunakan dalam kalimat?,"Apakah kalimat perintah harus pakai tanda seru? Tanda seru dipakai sesudah ungkapan atau pernyataan yang berupa seruan, perintah, atau yang menggambarkan kesungguhan, ketidakpercayaan, atau emosi yang kuat.","Pertanyaan: Kapan tanda seru digunakan dalam kalimat?
Jawaban: Apakah kalimat perintah harus pakai tanda seru? Tanda seru dipakai sesudah ungkapan atau pernyataan yang berupa seruan, perintah, atau yang menggambarkan kesungguhan, ketidakpercayaan, atau emosi yang kuat.
Contoh Kesalahan: Bersihkan kamar itu sekarang juga.
Contoh Perbaikan: Bersihkan kamar itu sekarang juga!",EYD V - Badan Bahasa Kemendikbudristek (ejaan.kemendikdasmen.go.id)
Apa fungsi tanda kurung dalam kalimat?,"Kapan pakai tanda kurung biasa? Tanda kurung dipakai untuk mengapit keterangan atau penjelasan tambahan, mengapit keterangan yang bukan bagian utama kalimat, serta mengapit huruf atau angka yang menandai perincian.","Pertanyaan: Apa fungsi tanda kurung dalam kalimat?
Jawaban: Kapan pakai tanda kurung biasa? Tanda kurung dipakai untuk mengapit keterangan atau penjelasan tambahan, mengapit keterangan yang bukan bagian utama kalimat, serta mengapit huruf atau angka yang menandai perincian.
Contoh Kesalahan: Dia menerima uang muka itu jumlahnya tidak disebutkan.
Contoh Perbaikan: Dia menerima uang muka (jumlahnya tidak disebutkan).",EYD V - Badan Bahasa Kemendikbudristek (ejaan.kemendikdasmen.go.id)
Kapan tanda kurung siku digunakan?,"Apa beda tanda kurung siku dan tanda kurung biasa? Tanda kurung siku dipakai untuk mengapit huruf, kata, atau kelompok kata sebagai koreksi atau tambahan dari penulis atas kesalahan atau kekurangan dalam naskah asli yang ditulis orang lain, serta untuk mengapit keterangan dalam kalimat penjelas yang sudah bertanda kurung.","Pertanyaan: Kapan tanda kurung siku digunakan?
Jawaban: Apa beda tanda kurung siku dan tanda kurung biasa? Tanda kurung siku dipakai untuk mengapit huruf, kata, atau kelompok kata sebagai koreksi atau tambahan dari penulis atas kesalahan atau kekurangan dalam naskah asli yang ditulis orang lain, serta untuk mengapit keterangan dalam kalimat penjelas yang sudah bertanda kurung.
Contoh Kesalahan: Persamaan kedua planet itu (perbedaannya dibicarakan pada Bab (lihat halaman 35).
Contoh Perbaikan: Persamaan kedua planet itu (perbedaannya dibicarakan pada Bab [lihat halaman 35]).",EYD V - Badan Bahasa Kemendikbudristek (ejaan.kemendikdasmen.go.id)
Apa fungsi tanda elipsis (...) dalam tulisan?,"Bagaimana cara menunjukkan ada bagian kutipan yang dihilangkan? Tanda elipsis menggambarkan ada bagian kalimat atau kutipan yang dihilangkan. Jika bagian yang dihilangkan berada di akhir kalimat, tanda elipsis diikuti tanda titik sehingga menjadi empat titik.","Pertanyaan: Apa fungsi tanda elipsis (...) dalam tulisan?
Jawaban: Bagaimana cara menunjukkan ada bagian kutipan yang dihilangkan? Tanda elipsis menggambarkan ada bagian kalimat atau kutipan yang dihilangkan. Jika bagian yang dihilangkan berada di akhir kalimat, tanda elipsis diikuti tanda titik sehingga menjadi empat titik.
Contoh Kesalahan: Faktor produksi meliputi tanah, modal, tenaga kerja..
Contoh Perbaikan: Faktor produksi meliputi tanah, modal, ... dan sebagainya.",EYD V - Badan Bahasa Kemendikbudristek (ejaan.kemendikdasmen.go.id)
Kapan tanda garis miring digunakan?,"Apakah nomor surat pakai garis miring? Tanda garis miring dipakai dalam penomoran kode surat, sebagai pengganti kata dan, atau, atau per yang berarti tiap, serta untuk mengapit huruf, kata, atau kelompok kata sebagai penanda bagian yang seharusnya dihilangkan.","Pertanyaan: Kapan tanda garis miring digunakan?
Jawaban: Apakah nomor surat pakai garis miring? Tanda garis miring dipakai dalam penomoran kode surat, sebagai pengganti kata dan, atau, atau per yang berarti tiap, serta untuk mengapit huruf, kata, atau kelompok kata sebagai penanda bagian yang seharusnya dihilangkan.
Contoh Kesalahan: Nomor: 7 PK 2024. Mahasiswa dan atau dosen wajib hadir.
Contoh Perbaikan: Nomor: 7/PK/2024. Mahasiswa/dosen wajib hadir.",EYD V - Badan Bahasa Kemendikbudristek (ejaan.kemendikdasmen.go.id)
Bagaimana penulisan tanda apostrof (penyingkat)?,"Kenapa 1 Januari 88 ditulis 1 Januari '88? Tanda apostrof dipakai untuk menunjukkan penghilangan bagian kata atau bagian angka tahun dalam konteks tertentu, misalnya dalam ragam santai atau penanggalan singkat.","Pertanyaan: Bagaimana penulisan tanda apostrof (penyingkat)?
Jawaban: Kenapa 1 Januari 88 ditulis 1 Januari '88? Tanda apostrof dipakai untuk menunjukkan penghilangan bagian kata atau bagian angka tahun dalam konteks tertentu, misalnya dalam ragam santai atau penanggalan singkat.
Contoh Kesalahan: Ali sudah datang tapi Ari belum. Malam tanggal 1 Januari 1988 hujan deras.
Contoh Perbaikan: Ali sudah datang, tapi Ari 'lum datang. Malam tanggal 1 Januari '88 hujan deras.",EYD V - Badan Bahasa Kemendikbudristek (ejaan.kemendikdasmen.go.id)
"Bagaimana penulisan -ku, -mu, -nya, dan kau- yang benar?","Apakah buku ku ditulis terpisah? Bentuk terikat -ku, -mu, -nya sebagai kata ganti kepunyaan dan kau- sebagai kata ganti orang ditulis serangkai dengan kata yang mendahului atau mengikutinya.","Pertanyaan: Bagaimana penulisan -ku, -mu, -nya, dan kau- yang benar?
Jawaban: Apakah buku ku ditulis terpisah? Bentuk terikat -ku, -mu, -nya sebagai kata ganti kepunyaan dan kau- sebagai kata ganti orang ditulis serangkai dengan kata yang mendahului atau mengikutinya.
Contoh Kesalahan: Ini buku ku. Rumah nya besar. Kau harus pergi ditulis kauharus pergi salah bila dipisah jadi kau harus.
Contoh Perbaikan: Ini bukuku. Rumahnya besar. Kauambil buku itu.",EYD V - Badan Bahasa Kemendikbudristek (ejaan.kemendikdasmen.go.id)
Apakah si dan sang ditulis dengan huruf kapital?,"Kenapa si kecil ditulis huruf kecil semua? Kata sandang si dan sang ditulis terpisah dari kata yang mengikutinya dan ditulis dengan huruf kecil, kecuali jika berada di awal kalimat atau merupakan bagian dari nama diri yang dipersonifikasikan sebagai judul karya sastra.","Pertanyaan: Apakah si dan sang ditulis dengan huruf kapital?
Jawaban: Kenapa si kecil ditulis huruf kecil semua? Kata sandang si dan sang ditulis terpisah dari kata yang mengikutinya dan ditulis dengan huruf kecil, kecuali jika berada di awal kalimat atau merupakan bagian dari nama diri yang dipersonifikasikan sebagai judul karya sastra.
Contoh Kesalahan: SiAli menolong Sang kancil yang terjebak.
Contoh Perbaikan: Si Ali menolong sang kancil yang terjebak.",EYD V - Badan Bahasa Kemendikbudristek (ejaan.kemendikdasmen.go.id)
Kapan huruf kapital dipakai untuk kutipan langsung dan awal kalimat?,"Apakah huruf pertama kutipan langsung harus kapital? Huruf kapital dipakai sebagai huruf pertama kata pada awal kalimat dan huruf pertama petikan langsung, meskipun petikan tersebut berada di tengah kalimat.","Pertanyaan: Kapan huruf kapital dipakai untuk kutipan langsung dan awal kalimat?
Jawaban: Apakah huruf pertama kutipan langsung harus kapital? Huruf kapital dipakai sebagai huruf pertama kata pada awal kalimat dan huruf pertama petikan langsung, meskipun petikan tersebut berada di tengah kalimat.
Contoh Kesalahan: guru berkata, ""kerjakan tugas ini dengan teliti.""
Contoh Perbaikan: Guru berkata, ""Kerjakan tugas ini dengan teliti.""",EYD V - Badan Bahasa Kemendikbudristek (ejaan.kemendikdasmen.go.id)
"Apakah nama hari, bulan, dan hari raya pakai huruf kapital?","Kenapa hari senin ditulis Senin? Huruf kapital dipakai sebagai huruf pertama nama hari, bulan, tahun, hari raya, dan peristiwa sejarah. Huruf kapital tidak dipakai jika nama peristiwa sejarah tersebut tidak dipakai sebagai nama.","Pertanyaan: Apakah nama hari, bulan, dan hari raya pakai huruf kapital?
Jawaban: Kenapa hari senin ditulis Senin? Huruf kapital dipakai sebagai huruf pertama nama hari, bulan, tahun, hari raya, dan peristiwa sejarah. Huruf kapital tidak dipakai jika nama peristiwa sejarah tersebut tidak dipakai sebagai nama.
Contoh Kesalahan: Ia lahir pada hari senin bulan agustus. Kita memperingati hari Kemerdekaan setiap tahun.
Contoh Perbaikan: Ia lahir pada hari Senin bulan Agustus. Kita memperingati Hari Kemerdekaan setiap tahun.",EYD V - Badan Bahasa Kemendikbudristek (ejaan.kemendikdasmen.go.id)
Apakah nama agama dan kitab suci ditulis dengan huruf kapital?,"Kenapa kata Tuhan dan Islam ditulis huruf besar? Huruf kapital dipakai sebagai huruf pertama nama agama, kitab suci, dan Tuhan, termasuk kata ganti untuk Tuhan seperti -Nya dan Dia.","Pertanyaan: Apakah nama agama dan kitab suci ditulis dengan huruf kapital?
Jawaban: Kenapa kata Tuhan dan Islam ditulis huruf besar? Huruf kapital dipakai sebagai huruf pertama nama agama, kitab suci, dan Tuhan, termasuk kata ganti untuk Tuhan seperti -Nya dan Dia.
Contoh Kesalahan: Umat islam membaca Al-quran dan berdoa kepada tuhan yang maha esa.
Contoh Perbaikan: Umat Islam membaca Al-Qur'an dan berdoa kepada Tuhan Yang Mahaesa.",EYD V - Badan Bahasa Kemendikbudristek (ejaan.kemendikdasmen.go.id)
