question,answer,formatted_text,source
How should I proofread my essay?,"What should I focus on when editing? Experts suggest proofreading in multiple passes, each focusing on a different aspect first for content and argument structure, second for grammar and sentence clarity, and third for spelling, punctuation, and formatting.","Pertanyaan: How should I proofread my essay?
Jawaban: What should I focus on when editing? Experts suggest proofreading in multiple passes, each focusing on a different aspect first for content and argument structure, second for grammar and sentence clarity, and third for spelling, punctuation, and formatting.",Purdue OWL (owl.purdue.edu)
Apa itu esai akademik?,"Esai akademik adalah bentuk tulisan ilmiah yang menyampaikan ide dan argumen secara terstruktur berdasarkan bukti. Memiliki 8 ciri utama menurut Stephen Bailey: (1) kompleksitas - bahasa tulis lebih kompleks daripada bahasa lisan, (2) formalitas - menghindari bahasa sehari-hari dan kata ganti orang pertama, (3) presisi - fakta dan angka disampaikan secara akurat, (4) objektivitas - berfokus pada informasi dan argumen, bukan opini pribadi, (5) eksplisitas - hubungan antar-gagasan ditandai secara jelas, (6) akurasi - penggunaan kosakata yang tepat sesuai bidang ilmu, (7) hedging - penggunaan bahasa berhati-hati untuk mengakui ketidakpastian klaim, dan (8) tanggung jawab - penulis memberikan bukti dan alasan atas klaim yang disampaikan. Sumber: Stephen Bailey, Academic Writing: A Handbook for International Students (Routledge).","Pertanyaan: Apa itu esai akademik?
Jawaban: Esai akademik adalah bentuk tulisan ilmiah yang menyampaikan ide dan argumen secara terstruktur berdasarkan bukti. Memiliki 8 ciri utama menurut Stephen Bailey: (1) kompleksitas - bahasa tulis lebih kompleks daripada bahasa lisan, (2) formalitas - menghindari bahasa sehari-hari dan kata ganti orang pertama, (3) presisi - fakta dan angka disampaikan secara akurat, (4) objektivitas - berfokus pada informasi dan argumen, bukan opini pribadi, (5) eksplisitas - hubungan antar-gagasan ditandai secara jelas, (6) akurasi - penggunaan kosakata yang tepat sesuai bidang ilmu, (7) hedging - penggunaan bahasa berhati-hati untuk mengakui ketidakpastian klaim, dan (8) tanggung jawab - penulis memberikan bukti dan alasan atas klaim yang disampaikan. Sumber: Stephen Bailey, Academic Writing: A Handbook for International Students (Routledge).",Buku Siswa Bahasa Indonesia Kurikulum Merdeka - Kemdikbud (buku.kemdikbud.go.id)
Apa saja jenis-jenis esai utama?,"Terdapat 4 jenis utama esai yang dikenal dengan istilah EDNA (Exposition, Description, Narration, Argumentation): (1) Expository - memaparkan informasi secara faktual dan objektif tanpa membangun argumen, ditulis dengan nada netral dan alur logis, (2) Descriptive - menggambarkan objek, tempat, atau pengalaman secara rinci menggunakan pancaindra, biasanya disusun berdasarkan urutan ruang atau tingkat kepentingan, (3) Narrative - menceritakan sebuah peristiwa atau pengalaman lengkap dengan tokoh, konflik, dan latar, (4) Argumentative - menyajikan klaim yang didukung bukti dan analisis untuk meyakinkan pembaca. Sumber: Purdue OWL, Expository Essays; Scribbr, The Four Main Types of Essay.","Pertanyaan: Apa saja jenis-jenis esai utama?
Jawaban: Terdapat 4 jenis utama esai yang dikenal dengan istilah EDNA (Exposition, Description, Narration, Argumentation): (1) Expository - memaparkan informasi secara faktual dan objektif tanpa membangun argumen, ditulis dengan nada netral dan alur logis, (2) Descriptive - menggambarkan objek, tempat, atau pengalaman secara rinci menggunakan pancaindra, biasanya disusun berdasarkan urutan ruang atau tingkat kepentingan, (3) Narrative - menceritakan sebuah peristiwa atau pengalaman lengkap dengan tokoh, konflik, dan latar, (4) Argumentative - menyajikan klaim yang didukung bukti dan analisis untuk meyakinkan pembaca. Sumber: Purdue OWL, Expository Essays; Scribbr, The Four Main Types of Essay.",Buku Siswa Bahasa Indonesia Kurikulum Merdeka - Kemdikbud (buku.kemdikbud.go.id)
Apa struktur dasar esai?,"Struktur esai terdiri dari 3 bagian utama: (1) Pendahuluan (Introduction) - berisi pernyataan umum dan tesis yang menjadi fokus esai, (2) Isi/Tubuh (Body) - berisi beberapa paragraf yang masing-masing mengembangkan satu gagasan pendukung tesis disertai bukti atau contoh, (3) Penutup (Conclusion) - merangkum kembali tesis dan gagasan utama tanpa menambahkan informasi baru. Sumber: Purdue OWL, Essay Writing; Buku Siswa Bahasa Indonesia Kelas X Kurikulum Merdeka, Kemdikbud.","Pertanyaan: Apa struktur dasar esai?
Jawaban: Struktur esai terdiri dari 3 bagian utama: (1) Pendahuluan (Introduction) - berisi pernyataan umum dan tesis yang menjadi fokus esai, (2) Isi/Tubuh (Body) - berisi beberapa paragraf yang masing-masing mengembangkan satu gagasan pendukung tesis disertai bukti atau contoh, (3) Penutup (Conclusion) - merangkum kembali tesis dan gagasan utama tanpa menambahkan informasi baru. Sumber: Purdue OWL, Essay Writing; Buku Siswa Bahasa Indonesia Kelas X Kurikulum Merdeka, Kemdikbud.",Buku Siswa Bahasa Indonesia Kurikulum Merdeka - Kemdikbud (buku.kemdikbud.go.id)
Apa itu five-paragraph essay?,"Five-paragraph essay adalah metode umum penulisan esai ekspositori yang terdiri dari: (1) satu paragraf pendahuluan berisi tesis, (2) tiga paragraf isi yang masing-masing mengembangkan satu gagasan pendukung tesis dengan bukti dan contoh, (3) satu paragraf penutup yang menegaskan kembali tesis dan merangkum gagasan utama. Struktur ini banyak dipakai sebagai kerangka dasar sebelum menulis esai yang lebih kompleks. Sumber: Purdue OWL, Essay Writing.","Pertanyaan: Apa itu five-paragraph essay?
Jawaban: Five-paragraph essay adalah metode umum penulisan esai ekspositori yang terdiri dari: (1) satu paragraf pendahuluan berisi tesis, (2) tiga paragraf isi yang masing-masing mengembangkan satu gagasan pendukung tesis dengan bukti dan contoh, (3) satu paragraf penutup yang menegaskan kembali tesis dan merangkum gagasan utama. Struktur ini banyak dipakai sebagai kerangka dasar sebelum menulis esai yang lebih kompleks. Sumber: Purdue OWL, Essay Writing.",Purdue OWL (owl.purdue.edu)
Bagaimana langkah-langkah menulis esai?,"Langkah menulis esai: (1) Menentukan topik dan tujuan penulisan, (2) melakukan riset dan mengumpulkan bahan atau data pendukung, (3) membuat outline atau kerangka agar gagasan tersusun logis, (4) menulis draf kasar tanpa terlalu memikirkan tata bahasa untuk menuangkan ide, (5) merevisi struktur dan kejelasan argumen, (6) menyunting ejaan, tanda baca, dan format penulisan. Sumber: Purdue OWL, The Writing Process; Buku Siswa Bahasa Indonesia Kurikulum Merdeka, Kemdikbud.","Pertanyaan: Bagaimana langkah-langkah menulis esai?
Jawaban: Langkah menulis esai: (1) Menentukan topik dan tujuan penulisan, (2) melakukan riset dan mengumpulkan bahan atau data pendukung, (3) membuat outline atau kerangka agar gagasan tersusun logis, (4) menulis draf kasar tanpa terlalu memikirkan tata bahasa untuk menuangkan ide, (5) merevisi struktur dan kejelasan argumen, (6) menyunting ejaan, tanda baca, dan format penulisan. Sumber: Purdue OWL, The Writing Process; Buku Siswa Bahasa Indonesia Kurikulum Merdeka, Kemdikbud.",Buku Siswa Bahasa Indonesia Kurikulum Merdeka - Kemdikbud (buku.kemdikbud.go.id)
Apa itu kalimat tesis (thesis statement)?,Kalimat tesis adalah pernyataan inti yang menjadi fokus seluruh esai. Biasanya muncul di akhir paragraf pendahuluan dan merangkum argumen utama penulis. Seluruh paragraf isi harus mendukung dan membuktikan tesis ini.,"Pertanyaan: Apa itu kalimat tesis (thesis statement)?
Jawaban: Kalimat tesis adalah pernyataan inti yang menjadi fokus seluruh esai. Biasanya muncul di akhir paragraf pendahuluan dan merangkum argumen utama penulis. Seluruh paragraf isi harus mendukung dan membuktikan tesis ini.",Purdue OWL (owl.purdue.edu)
Bagaimana cara menulis paragraf isi yang baik?,"Setiap paragraf isi harus memuat: (1) kalimat utama (topic sentence) sebagai fokus argumen paragraf, (2) kalimat penjelas berisi bukti, data, atau contoh yang mendukung kalimat utama, (3) kalimat transisi yang menghubungkan paragraf tersebut dengan paragraf sebelum dan sesudahnya, (4) kalimat penutup yang menegaskan kembali gagasan paragraf serta kaitannya dengan tesis esai. Sumber: Purdue OWL, Essay Writing.","Pertanyaan: Bagaimana cara menulis paragraf isi yang baik?
Jawaban: Setiap paragraf isi harus memuat: (1) kalimat utama (topic sentence) sebagai fokus argumen paragraf, (2) kalimat penjelas berisi bukti, data, atau contoh yang mendukung kalimat utama, (3) kalimat transisi yang menghubungkan paragraf tersebut dengan paragraf sebelum dan sesudahnya, (4) kalimat penutup yang menegaskan kembali gagasan paragraf serta kaitannya dengan tesis esai. Sumber: Purdue OWL, Essay Writing.",Buku Siswa Bahasa Indonesia Kurikulum Merdeka - Kemdikbud (buku.kemdikbud.go.id)
Apa yang harus diperhatikan dalam penyuntingan esai?,"Penyuntingan esai mencakup: (1) meneliti penggunaan bahasa, ejaan, dan tanda baca, (2) memeriksa kejelasan dan keterhubungan argumen antarparagraf (koherensi dan kohesi), (3) memastikan setiap paragraf mendukung tesis, (4) menghilangkan kalimat yang bertele-tele atau tidak perlu, (5) membaca ulang esai dengan suara keras untuk mengecek kelancarannya. Sumber: Purdue OWL, Editing and Proofreading.","Pertanyaan: Apa yang harus diperhatikan dalam penyuntingan esai?
Jawaban: Penyuntingan esai mencakup: (1) meneliti penggunaan bahasa, ejaan, dan tanda baca, (2) memeriksa kejelasan dan keterhubungan argumen antarparagraf (koherensi dan kohesi), (3) memastikan setiap paragraf mendukung tesis, (4) menghilangkan kalimat yang bertele-tele atau tidak perlu, (5) membaca ulang esai dengan suara keras untuk mengecek kelancarannya. Sumber: Purdue OWL, Editing and Proofreading.",Buku Siswa Bahasa Indonesia Kurikulum Merdeka - Kemdikbud (buku.kemdikbud.go.id)
Apa ciri-ciri esai argumentatif/persuasif?,"Esai argumentatif bercirikan: (1) memiliki posisi/klaim yang jelas dan dapat diperdebatkan, bukan sekadar fakta umum, (2) didukung oleh bukti, data, atau contoh konkret, (3) menyertakan dan menanggapi argumen tandingan (counterargument), (4) menggunakan penalaran logis untuk menghubungkan bukti dengan klaim, (5) diakhiri dengan kesimpulan yang menegaskan kembali posisi penulis. Sumber: Purdue OWL, Essay Writing; Scribbr, Types of Essays.","Pertanyaan: Apa ciri-ciri esai argumentatif/persuasif?
Jawaban: Esai argumentatif bercirikan: (1) memiliki posisi/klaim yang jelas dan dapat diperdebatkan, bukan sekadar fakta umum, (2) didukung oleh bukti, data, atau contoh konkret, (3) menyertakan dan menanggapi argumen tandingan (counterargument), (4) menggunakan penalaran logis untuk menghubungkan bukti dengan klaim, (5) diakhiri dengan kesimpulan yang menegaskan kembali posisi penulis. Sumber: Purdue OWL, Essay Writing; Scribbr, Types of Essays.",Buku Siswa Bahasa Indonesia Kurikulum Merdeka - Kemdikbud (buku.kemdikbud.go.id)
Bagaimana cara mengutip sumber dalam esai?,"Kutipan dalam esai harus: (1) menyertakan referensi sumber yang jelas berupa nama penulis, tahun, dan judul, (2) dituliskan sesuai gaya sitasi yang berlaku seperti APA atau MLA, (3) membedakan dengan jelas antara kutipan langsung dan parafrase, (4) mencantumkan tanda petik dan halaman untuk kutipan langsung, (5) dicantumkan dalam daftar pustaka di akhir tulisan untuk menghindari plagiarisme. Sumber: Purdue OWL, Research and Citation; Pedoman Penulisan Karya Ilmiah UPI 2024.","Pertanyaan: Bagaimana cara mengutip sumber dalam esai?
Jawaban: Kutipan dalam esai harus: (1) menyertakan referensi sumber yang jelas berupa nama penulis, tahun, dan judul, (2) dituliskan sesuai gaya sitasi yang berlaku seperti APA atau MLA, (3) membedakan dengan jelas antara kutipan langsung dan parafrase, (4) mencantumkan tanda petik dan halaman untuk kutipan langsung, (5) dicantumkan dalam daftar pustaka di akhir tulisan untuk menghindari plagiarisme. Sumber: Purdue OWL, Research and Citation; Pedoman Penulisan Karya Ilmiah UPI 2024.",Purdue OWL (owl.purdue.edu)
Apa perbedaan esai ilmiah dan esai non-ilmiah?,"Esai ilmiah bersifat: formal, objektif, berdasarkan data dan referensi yang dapat diverifikasi, menggunakan bahasa baku dan istilah teknis, serta mengikuti struktur dan format sitasi yang baku seperti dalam karya tulis ilmiah atau jurnal. Esai non-ilmiah bersifat lebih bebas, dapat memuat opini pribadi dan gaya bahasa figuratif, serta tidak wajib menyertakan referensi ilmiah, misalnya esai populer atau esai reflektif. Sumber: Pedoman Penulisan Karya Ilmiah UPI 2024.","Pertanyaan: Apa perbedaan esai ilmiah dan esai non-ilmiah?
Jawaban: Esai ilmiah bersifat: formal, objektif, berdasarkan data dan referensi yang dapat diverifikasi, menggunakan bahasa baku dan istilah teknis, serta mengikuti struktur dan format sitasi yang baku seperti dalam karya tulis ilmiah atau jurnal. Esai non-ilmiah bersifat lebih bebas, dapat memuat opini pribadi dan gaya bahasa figuratif, serta tidak wajib menyertakan referensi ilmiah, misalnya esai populer atau esai reflektif. Sumber: Pedoman Penulisan Karya Ilmiah UPI 2024.",Buku Siswa Bahasa Indonesia Kurikulum Merdeka - Kemdikbud (buku.kemdikbud.go.id)
Apa panduan internasional terbaik untuk penulisan esai akademik?,"Panduan internasional terpercaya: (1) Purdue OWL (owl.purdue.edu) - standar global gratis untuk tata bahasa, struktur esai, dan gaya sitasi APA/MLA/Chicago, (2) Routledge FreeBook ""A Practical Guide to Academic Writing for International Students"" oleh Stephen Bailey - membahas dasar penulisan, penyusunan paragraf, pendahuluan dan kesimpulan, serta gaya akademik, (3) Scribbr Essay Writing Guide - panduan praktis jenis dan struktur esai. Sumber: owl.purdue.edu; routledge.com/rsc/downloads; scribbr.com.","Pertanyaan: Apa panduan internasional terbaik untuk penulisan esai akademik?
Jawaban: Panduan internasional terpercaya: (1) Purdue OWL (owl.purdue.edu) - standar global gratis untuk tata bahasa, struktur esai, dan gaya sitasi APA/MLA/Chicago, (2) Routledge FreeBook ""A Practical Guide to Academic Writing for International Students"" oleh Stephen Bailey - membahas dasar penulisan, penyusunan paragraf, pendahuluan dan kesimpulan, serta gaya akademik, (3) Scribbr Essay Writing Guide - panduan praktis jenis dan struktur esai. Sumber: owl.purdue.edu; routledge.com/rsc/downloads; scribbr.com.","Purdue OWL (owl.purdue.edu); Routledge FreeBook - A Practical Guide to Academic Writing for International Students, Stephen Bailey (routledge.com/rsc/downloads); Scribbr Essay Writing Guide (scribbr.com)"
Apa panduan resmi penulisan karya ilmiah di Indonesia?,"Panduan resmi di Indonesia: (1) Pedoman Penulisan Karya Ilmiah UPI 2024 (Universitas Pendidikan Indonesia, terbit Desember 2024) yang mengatur format dan sistematika penulisan karya ilmiah mahasiswa, (2) Buku Siswa Bahasa Indonesia Kurikulum Merdeka terbitan Kemdikbud yang memuat materi struktur teks eksposisi dan esai untuk jenjang SMA, (3) Pedoman Umum Ejaan Bahasa Indonesia (EYD V) dari Badan Bahasa Kemendikbudristek untuk kaidah ejaan dan tanda baca. Sumber: kurtek.upi.edu; buku.kemdikbud.go.id; ejaan.kemdikbud.go.id.","Pertanyaan: Apa panduan resmi penulisan karya ilmiah di Indonesia?
Jawaban: Panduan resmi di Indonesia: (1) Pedoman Penulisan Karya Ilmiah UPI 2024 (Universitas Pendidikan Indonesia, terbit Desember 2024) yang mengatur format dan sistematika penulisan karya ilmiah mahasiswa, (2) Buku Siswa Bahasa Indonesia Kurikulum Merdeka terbitan Kemdikbud yang memuat materi struktur teks eksposisi dan esai untuk jenjang SMA, (3) Pedoman Umum Ejaan Bahasa Indonesia (EYD V) dari Badan Bahasa Kemendikbudristek untuk kaidah ejaan dan tanda baca. Sumber: kurtek.upi.edu; buku.kemdikbud.go.id; ejaan.kemdikbud.go.id.",Pedoman Penulisan Karya Ilmiah UPI 2024 (kurtek.upi.edu); Buku Siswa Bahasa Indonesia Kurikulum Merdeka - Kemdikbud (buku.kemdikbud.go.id); EYD V - Badan Bahasa Kemendikbudristek (ejaan.kemendikdasmen.go.id)
Bagaimana struktur esai beasiswa yang baik?,"Esai beasiswa yang baik mencakup: (1) latar belakang pribadi yang relevan dan otentik, (2) motivasi dan tujuan yang jelas mengapa melamar beasiswa atau program tersebut, (3) pencapaian atau pengalaman konkret yang mendukung kelayakan penulis, (4) rencana masa depan dan kontribusi setelah menyelesaikan studi, (5) penutup yang menegaskan kembali komitmen dan kesesuaian penulis dengan nilai beasiswa tersebut. Sumber: Purdue OWL, Statements of Purpose.","Pertanyaan: Bagaimana struktur esai beasiswa yang baik?
Jawaban: Esai beasiswa yang baik mencakup: (1) latar belakang pribadi yang relevan dan otentik, (2) motivasi dan tujuan yang jelas mengapa melamar beasiswa atau program tersebut, (3) pencapaian atau pengalaman konkret yang mendukung kelayakan penulis, (4) rencana masa depan dan kontribusi setelah menyelesaikan studi, (5) penutup yang menegaskan kembali komitmen dan kesesuaian penulis dengan nilai beasiswa tersebut. Sumber: Purdue OWL, Statements of Purpose.",Purdue OWL (owl.purdue.edu)
Apa yang dimaksud plagiarisme dalam penulisan esai?,"Plagiarisme adalah penggunaan ide, kalimat, atau karya orang lain tanpa mencantumkan sumber atau seolah-olah merupakan karya sendiri. Bentuknya dapat berupa menyalin teks secara langsung tanpa kutipan, memparafrasekan tanpa menyebut sumber, atau menggunakan gagasan orang lain tanpa izin. Plagiarisme dapat dihindari dengan selalu mencantumkan referensi, menggunakan tanda kutip untuk kutipan langsung, dan memparafrasekan dengan tetap mencantumkan sumber. Sumber: Purdue OWL, Avoiding Plagiarism; Pedoman Penulisan Karya Ilmiah UPI 2024.","Pertanyaan: Apa yang dimaksud plagiarisme dalam penulisan esai?
Jawaban: Plagiarisme adalah penggunaan ide, kalimat, atau karya orang lain tanpa mencantumkan sumber atau seolah-olah merupakan karya sendiri. Bentuknya dapat berupa menyalin teks secara langsung tanpa kutipan, memparafrasekan tanpa menyebut sumber, atau menggunakan gagasan orang lain tanpa izin. Plagiarisme dapat dihindari dengan selalu mencantumkan referensi, menggunakan tanda kutip untuk kutipan langsung, dan memparafrasekan dengan tetap mencantumkan sumber. Sumber: Purdue OWL, Avoiding Plagiarism; Pedoman Penulisan Karya Ilmiah UPI 2024.",Purdue OWL (owl.purdue.edu); Pedoman Penulisan Karya Ilmiah UPI 2024 (kurtek.upi.edu)
Bagaimana cara menulis pendahuluan esai yang menarik?,"Pendahuluan esai yang baik: (1) dimulai dengan hook atau kalimat pembuka yang menarik seperti fakta mengejutkan, pertanyaan retoris, anekdot, atau kutipan, (2) memberikan konteks atau latar belakang umum tentang topik, (3) mempersempit fokus secara bertahap menuju topik spesifik, (4) diakhiri dengan kalimat tesis yang menyatakan posisi atau gagasan utama esai. Sumber: Purdue OWL, Essay Writing; Buku Siswa Bahasa Indonesia Kurikulum Merdeka, Kemdikbud.","Pertanyaan: Bagaimana cara menulis pendahuluan esai yang menarik?
Jawaban: Pendahuluan esai yang baik: (1) dimulai dengan hook atau kalimat pembuka yang menarik seperti fakta mengejutkan, pertanyaan retoris, anekdot, atau kutipan, (2) memberikan konteks atau latar belakang umum tentang topik, (3) mempersempit fokus secara bertahap menuju topik spesifik, (4) diakhiri dengan kalimat tesis yang menyatakan posisi atau gagasan utama esai. Sumber: Purdue OWL, Essay Writing; Buku Siswa Bahasa Indonesia Kurikulum Merdeka, Kemdikbud.",Buku Siswa Bahasa Indonesia Kurikulum Merdeka - Kemdikbud (buku.kemdikbud.go.id)
Apa prinsip-prinsip penulisan akademik internasional?,"Prinsip penulisan akademik internasional menurut Purdue OWL dan Routledge (Stephen Bailey): (1) Clarity (kejelasan) - gagasan disampaikan secara langsung dan mudah dipahami, (2) Concision (keringkasan) - menghindari kata dan frasa yang bertele-tele, (3) Coherence (keterpaduan makna) - antar-gagasan saling berkaitan secara logis, (4) Cohesion (keterkaitan kalimat) - menggunakan kata hubung yang tepat, (5) Formality (formalitas) - menghindari bahasa sehari-hari dan kontraksi, (6) Objectivity (objektivitas) - berbasis bukti, bukan opini pribadi, (7) Accuracy (akurasi) - penggunaan istilah dan data yang tepat. Sumber: owl.purdue.edu; Stephen Bailey, Academic Writing for University Students (Routledge).","Pertanyaan: Apa prinsip-prinsip penulisan akademik internasional?
Jawaban: Prinsip penulisan akademik internasional menurut Purdue OWL dan Routledge (Stephen Bailey): (1) Clarity (kejelasan) - gagasan disampaikan secara langsung dan mudah dipahami, (2) Concision (keringkasan) - menghindari kata dan frasa yang bertele-tele, (3) Coherence (keterpaduan makna) - antar-gagasan saling berkaitan secara logis, (4) Cohesion (keterkaitan kalimat) - menggunakan kata hubung yang tepat, (5) Formality (formalitas) - menghindari bahasa sehari-hari dan kontraksi, (6) Objectivity (objektivitas) - berbasis bukti, bukan opini pribadi, (7) Accuracy (akurasi) - penggunaan istilah dan data yang tepat. Sumber: owl.purdue.edu; Stephen Bailey, Academic Writing for University Students (Routledge).","Purdue OWL (owl.purdue.edu); Routledge FreeBook - A Practical Guide to Academic Writing for International Students, Stephen Bailey (routledge.com/rsc/downloads)"
Di mana bisa download panduan penulisan esai gratis?,"Sumber download gratis: (1) Routledge FreeBook ""A Practical Guide to Academic Writing for International Students"" di routledge.com/rsc/downloads, (2) Buku Siswa dan Buku Guru Bahasa Indonesia Kurikulum Merdeka di buku.kemdikbud.go.id, (3) Pedoman Penulisan Karya Ilmiah UPI 2024 di kurtek.upi.edu, (4) Purdue OWL Essay Writing Guide di owl.purdue.edu, dapat diakses daring gratis tanpa login. Sumber: routledge.com/rsc/downloads; buku.kemdikbud.go.id; kurtek.upi.edu; owl.purdue.edu.","Pertanyaan: Di mana bisa download panduan penulisan esai gratis?
Jawaban: Sumber download gratis: (1) Routledge FreeBook ""A Practical Guide to Academic Writing for International Students"" di routledge.com/rsc/downloads, (2) Buku Siswa dan Buku Guru Bahasa Indonesia Kurikulum Merdeka di buku.kemdikbud.go.id, (3) Pedoman Penulisan Karya Ilmiah UPI 2024 di kurtek.upi.edu, (4) Purdue OWL Essay Writing Guide di owl.purdue.edu, dapat diakses daring gratis tanpa login. Sumber: routledge.com/rsc/downloads; buku.kemdikbud.go.id; kurtek.upi.edu; owl.purdue.edu.","Routledge FreeBook - A Practical Guide to Academic Writing for International Students, Stephen Bailey (routledge.com/rsc/downloads); Buku Siswa Bahasa Indonesia Kurikulum Merdeka - Kemdikbud (buku.kemdikbud.go.id); Pedoman Penulisan Karya Ilmiah UPI 2024 (kurtek.upi.edu); Purdue OWL (owl.purdue.edu)"
Apa itu esai?,"Esai adalah karangan yang mengemukakan pendapat, gagasan, atau sudut pandang penulis tentang suatu topik dari sudut pandang pribadi, namun tetap didukung oleh fakta dan alasan yang logis. Esai bersifat singkat, padat, dan menyampaikan satu gagasan utama secara utuh. Sumber: Buku Siswa Bahasa Indonesia Kurikulum Merdeka, Kemdikbud; Purdue OWL, Essay Writing.","Pertanyaan: Apa itu esai?
Jawaban: Esai adalah karangan yang mengemukakan pendapat, gagasan, atau sudut pandang penulis tentang suatu topik dari sudut pandang pribadi, namun tetap didukung oleh fakta dan alasan yang logis. Esai bersifat singkat, padat, dan menyampaikan satu gagasan utama secara utuh. Sumber: Buku Siswa Bahasa Indonesia Kurikulum Merdeka, Kemdikbud; Purdue OWL, Essay Writing.",Buku Siswa Bahasa Indonesia Kurikulum Merdeka - Kemdikbud (buku.kemdikbud.go.id)
Apa fungsi kesimpulan atau paragraf penutup esai?,"Paragraf penutup esai berfungsi merangkum kembali tesis dan gagasan utama yang telah dibahas, memberi penegasan pada argumen penulis, dan menutup tulisan dengan kesan akhir yang kuat bagi pembaca, misalnya melalui ajakan bertindak, refleksi, atau proyeksi ke depan. Paragraf penutup tidak boleh memuat informasi atau argumen baru. Sumber: Purdue OWL, Essay Writing; Buku Siswa Bahasa Indonesia Kurikulum Merdeka, Kemdikbud.","Pertanyaan: Apa fungsi kesimpulan atau paragraf penutup esai?
Jawaban: Paragraf penutup esai berfungsi merangkum kembali tesis dan gagasan utama yang telah dibahas, memberi penegasan pada argumen penulis, dan menutup tulisan dengan kesan akhir yang kuat bagi pembaca, misalnya melalui ajakan bertindak, refleksi, atau proyeksi ke depan. Paragraf penutup tidak boleh memuat informasi atau argumen baru. Sumber: Purdue OWL, Essay Writing; Buku Siswa Bahasa Indonesia Kurikulum Merdeka, Kemdikbud.",Buku Siswa Bahasa Indonesia Kurikulum Merdeka - Kemdikbud (buku.kemdikbud.go.id)
Apa itu esai deskriptif?,"Esai deskriptif adalah esai yang menggambarkan suatu objek, tempat, orang, atau pengalaman secara rinci dengan melibatkan pancaindra, sehingga pembaca seolah dapat melihat, mendengar, atau merasakan apa yang digambarkan. Esai ini biasanya disusun berdasarkan urutan ruang (spasial) atau tingkat kepentingan, bukan alur cerita seperti esai naratif. Sumber: Purdue OWL, Descriptive Essays.","Pertanyaan: Apa itu esai deskriptif?
Jawaban: Esai deskriptif adalah esai yang menggambarkan suatu objek, tempat, orang, atau pengalaman secara rinci dengan melibatkan pancaindra, sehingga pembaca seolah dapat melihat, mendengar, atau merasakan apa yang digambarkan. Esai ini biasanya disusun berdasarkan urutan ruang (spasial) atau tingkat kepentingan, bukan alur cerita seperti esai naratif. Sumber: Purdue OWL, Descriptive Essays.",Buku Siswa Bahasa Indonesia Kurikulum Merdeka - Kemdikbud (buku.kemdikbud.go.id)
